{
  "$schema": "http://json-schema.org/draft-07/schema#",
  "title": "academic-review findings",
  "type": "object",
  "required": ["mode", "workType", "findings"],
  "properties": {
    "mode": { "enum": ["author", "reviewer", "examiner"] },
    "workType": { "enum": ["manuscript", "thesis", "short-form"] },
    "standardsApplied": { "type": "array", "items": { "type": "string" } },
    "findings": {
      "type": "array",
      "items": {
        "type": "object",
        "required": ["id", "severity", "lens", "location", "problem", "why"],
        "properties": {
          "id": { "type": "string" },
          "severity": { "enum": ["fatal", "major", "minor", "cosmetic"] },
          "lens": { "enum": ["rigor", "clarity", "integrity", "literature"] },
          "location": { "type": "string", "minLength": 1 },
          "problem": { "type": "string", "minLength": 1 },
          "why": { "type": "string", "minLength": 1 },
          "fix": { "type": "string" },
          "evidence": { "type": "string" },
          "verifyFlag": { "type": "boolean" }
        }
      }
    },
    "recommendation": { "enum": ["accept", "minor", "major", "reject"] },
    "recommendationRationale": { "type": "string" },
    "pointsToAuthors": { "type": "array", "items": { "type": "string" } },
    "notesToEditor": { "type": "string" }
  }
}
